{
  "$schema": "../schemas/learning-unit.schema.json",
  "meta": {
    "id": "mahnung-verzugszinsen-mahnverfahren-verjaehrung",
    "slug": "mahnung-verzugszinsen-mahnverfahren-verjaehrung",
    "title": "Mahnung, Zinsen und gerichtliches Mahnverfahren",
    "description": "Verzug begründen, Verzugszinsen mit vorgegebenem Basiszinssatz berechnen, gerichtliche Schritte unterscheiden und Verjährung von Hemmung und Neubeginn trennen.",
    "domain": "WiSo",
    "domainLabel": "Wirtschafts- und Sozialkunde",
    "groupId": "wiso-7",
    "groupLabel": "W7 · Markt und Vertragsrecht",
    "itemId": "wiso-7__10",
    "week": "KW 40",
    "estimatedMinutes": 60,
    "relevance": "hoch",
    "sources": [
      "mahn-286",
      "mahn-288",
      "mahn-247",
      "mahn-195",
      "mahn-199",
      "mahn-204",
      "mahn-212",
      "mahn-214",
      "mahn-688",
      "mahn-692",
      "mahn-694",
      "mahn-696",
      "mahn-699",
      "mahn-700",
      "mahn-339",
      "mahn-167",
      "mahn-701",
      "mahn-209"
    ],
    "contentRevision": "2026-10-04.1",
    "contentStatus": "CURATED_DRAFT"
  },
  "objectives": [
    {
      "id": "verzug",
      "label": "Mahnung, Fälligkeit und Ausnahmen beim Zahlungsverzug begründen"
    },
    {
      "id": "zinsen",
      "label": "Verzugszinsen mit Prozentpunkten und klarer Tageskonvention berechnen"
    },
    {
      "id": "gericht",
      "label": "Mahnbescheid, Widerspruch, Vollstreckungsbescheid und Einspruch unterscheiden"
    },
    {
      "id": "frist",
      "label": "Regelverjährung, Hemmung und Neubeginn an Zeitfällen erklären"
    }
  ],
  "intro": "Nela, Tavon und alle Rechnungsfälle sind erfundene Lernmodelle. Quellenstand 04.10.2026, CURATED_DRAFT ohne menschliche Freigabe. Grundlagen gewöhnlicher inländischer Geldforderungen; keine individuelle Rechtsberatung, keine vollständige Prozess- oder Fristenberatung. Aufgaben geben Basiszinssatz, Verzugszeitraum und Zählkonvention ausdrücklich vor.",
  "curation": {
    "evidence": [
      {
        "sourceId": "mahn-286",
        "sourceLocator": "BGB § 286 – Verzug",
        "use": "Amtlichen Normtext gelesen; Abrufwege und Grenzen in MAHNVERFAHREN_QUELLEN.md. Eigene Fälle, keine Buchaufgabe.",
        "reviewStatus": "CURATED_DRAFT; menschliche Freigabe ausstehend"
      },
      {
        "sourceId": "mahn-288",
        "sourceLocator": "BGB § 288 – Verzugszinsen",
        "use": "Amtlichen Normtext gelesen; Abrufwege und Grenzen in MAHNVERFAHREN_QUELLEN.md. Eigene Fälle, keine Buchaufgabe.",
        "reviewStatus": "CURATED_DRAFT; menschliche Freigabe ausstehend"
      },
      {
        "sourceId": "mahn-247",
        "sourceLocator": "BGB § 247 – Basiszinssatz",
        "use": "Amtlichen Normtext gelesen; Abrufwege und Grenzen in MAHNVERFAHREN_QUELLEN.md. Eigene Fälle, keine Buchaufgabe.",
        "reviewStatus": "CURATED_DRAFT; menschliche Freigabe ausstehend"
      },
      {
        "sourceId": "mahn-195",
        "sourceLocator": "BGB § 195 – Regelmäßige Verjährung",
        "use": "Amtlichen Normtext gelesen; Abrufwege und Grenzen in MAHNVERFAHREN_QUELLEN.md. Eigene Fälle, keine Buchaufgabe.",
        "reviewStatus": "CURATED_DRAFT; menschliche Freigabe ausstehend"
      },
      {
        "sourceId": "mahn-199",
        "sourceLocator": "BGB § 199 – Verjährungsbeginn",
        "use": "Amtlichen Normtext gelesen; Abrufwege und Grenzen in MAHNVERFAHREN_QUELLEN.md. Eigene Fälle, keine Buchaufgabe.",
        "reviewStatus": "CURATED_DRAFT; menschliche Freigabe ausstehend"
      },
      {
        "sourceId": "mahn-204",
        "sourceLocator": "BGB § 204 – Hemmung",
        "use": "Amtlichen Normtext gelesen; Abrufwege und Grenzen in MAHNVERFAHREN_QUELLEN.md. Eigene Fälle, keine Buchaufgabe.",
        "reviewStatus": "CURATED_DRAFT; menschliche Freigabe ausstehend"
      },
      {
        "sourceId": "mahn-212",
        "sourceLocator": "BGB § 212 – Neubeginn",
        "use": "Amtlichen Normtext gelesen; Abrufwege und Grenzen in MAHNVERFAHREN_QUELLEN.md. Eigene Fälle, keine Buchaufgabe.",
        "reviewStatus": "CURATED_DRAFT; menschliche Freigabe ausstehend"
      },
      {
        "sourceId": "mahn-214",
        "sourceLocator": "BGB § 214 – Wirkung der Verjährung",
        "use": "Amtlichen Normtext gelesen; Abrufwege und Grenzen in MAHNVERFAHREN_QUELLEN.md. Eigene Fälle, keine Buchaufgabe.",
        "reviewStatus": "CURATED_DRAFT; menschliche Freigabe ausstehend"
      },
      {
        "sourceId": "mahn-688",
        "sourceLocator": "ZPO § 688 – Zulässigkeit",
        "use": "Amtlichen Normtext gelesen; Abrufwege und Grenzen in MAHNVERFAHREN_QUELLEN.md. Eigene Fälle, keine Buchaufgabe.",
        "reviewStatus": "CURATED_DRAFT; menschliche Freigabe ausstehend"
      },
      {
        "sourceId": "mahn-692",
        "sourceLocator": "ZPO § 692 – Mahnbescheid",
        "use": "Amtlichen Normtext gelesen; Abrufwege und Grenzen in MAHNVERFAHREN_QUELLEN.md. Eigene Fälle, keine Buchaufgabe.",
        "reviewStatus": "CURATED_DRAFT; menschliche Freigabe ausstehend"
      },
      {
        "sourceId": "mahn-694",
        "sourceLocator": "ZPO § 694 – Widerspruch",
        "use": "Amtlichen Normtext gelesen; Abrufwege und Grenzen in MAHNVERFAHREN_QUELLEN.md. Eigene Fälle, keine Buchaufgabe.",
        "reviewStatus": "CURATED_DRAFT; menschliche Freigabe ausstehend"
      },
      {
        "sourceId": "mahn-696",
        "sourceLocator": "ZPO § 696 – Streitiges Verfahren",
        "use": "Amtlichen Normtext gelesen; Abrufwege und Grenzen in MAHNVERFAHREN_QUELLEN.md. Eigene Fälle, keine Buchaufgabe.",
        "reviewStatus": "CURATED_DRAFT; menschliche Freigabe ausstehend"
      },
      {
        "sourceId": "mahn-699",
        "sourceLocator": "ZPO § 699 – Vollstreckungsbescheid",
        "use": "Amtlichen Normtext gelesen; Abrufwege und Grenzen in MAHNVERFAHREN_QUELLEN.md. Eigene Fälle, keine Buchaufgabe.",
        "reviewStatus": "CURATED_DRAFT; menschliche Freigabe ausstehend"
      },
      {
        "sourceId": "mahn-700",
        "sourceLocator": "ZPO § 700 – Einspruch",
        "use": "Amtlichen Normtext gelesen; Abrufwege und Grenzen in MAHNVERFAHREN_QUELLEN.md. Eigene Fälle, keine Buchaufgabe.",
        "reviewStatus": "CURATED_DRAFT; menschliche Freigabe ausstehend"
      },
      {
        "sourceId": "mahn-339",
        "sourceLocator": "ZPO § 339 – Einspruchsfrist",
        "use": "Amtlichen Normtext gelesen; Abrufwege und Grenzen in MAHNVERFAHREN_QUELLEN.md. Eigene Fälle, keine Buchaufgabe.",
        "reviewStatus": "CURATED_DRAFT; menschliche Freigabe ausstehend"
      },
      {
        "sourceId": "mahn-167",
        "sourceLocator": "BGB § 167 – Rückwirkung der Zustellung",
        "use": "Amtlichen Normtext gelesen; Abrufwege und Grenzen in MAHNVERFAHREN_QUELLEN.md. Eigene Fälle, keine Buchaufgabe.",
        "reviewStatus": "CURATED_DRAFT; menschliche Freigabe ausstehend"
      },
      {
        "sourceId": "mahn-701",
        "sourceLocator": "ZPO § 701 – Wegfall der Wirkung",
        "use": "Amtlichen Normtext gelesen; Abrufwege und Grenzen in MAHNVERFAHREN_QUELLEN.md. Eigene Fälle, keine Buchaufgabe.",
        "reviewStatus": "CURATED_DRAFT; menschliche Freigabe ausstehend"
      },
      {
        "sourceId": "mahn-209",
        "sourceLocator": "BGB § 209 – Wirkung der Hemmung",
        "use": "Amtlichen Normtext vollständig per Web gelesen; Hemmungszeit wird nicht eingerechnet.",
        "reviewStatus": "CURATED_DRAFT; menschliche Freigabe ausstehend"
      }
    ],
    "notes": [
      "Refero Direct Build: bestehende Gewährleistungs-Lernseite als 1440px-Light-Screenshot angesehen. Doppler-dominanter Deep-Space-Lock, gemeinsame Inter-Typografie, Shell und Runtime unverändert; technische SVGs und semantisches MathML.",
      "EUROPA-Rohtext 10707–10712 tatsächlich gelesen: nur angrenzender Vertrags-/Gerätebestellungsanker. Keine direkten Mahnverfahren-/Verjährungstreffer; die neue Lehre stützt sich auf amtliche Primärquellen. Keine privaten Fälle, Zahlen, Aufgaben, Lösungen oder Druckseiten übernommen.",
      "Hypothetischer Basiszinssatz 1,00 Prozent, ausdrücklich nicht aktueller amtlicher Wert. Für alle Rechenübungen tatsächliche vorgegebene Verzugstage durch 365; keine universelle gesetzliche 360-Tage-Regel behauptet."
    ]
  },
  "diagrams": [
    {
      "id": "verfahren",
      "type": "flow",
      "title": "Gerichtliche Schritte: zwei Bescheide unterscheiden",
      "description": "Vereinfachter inländischer Grundfall; Widerspruch führt nicht automatisch zum Prozesserfolg.",
      "items": [
        {
          "label": "Antrag",
          "detail": "Bestimmte Geldforderung geltend machen."
        },
        {
          "label": "Mahnbescheid",
          "detail": "Zustellung; zahlen oder widersprechen."
        },
        {
          "label": "Weiterer Antrag",
          "detail": "Ohne rechtzeitigen Widerspruch möglich."
        },
        {
          "label": "Vollstreckungsbescheid",
          "detail": "Titel; Einspruch gesondert prüfen."
        }
      ]
    },
    {
      "id": "zinsen",
      "type": "comparison",
      "title": "Aufschlag in Prozentpunkten, nicht in Prozent",
      "description": "Hypothetischer Basiszinssatz 1,00 Prozent im gesamten Übungszeitraum.",
      "items": [
        {
          "label": "Standard: 5 Punkte",
          "detail": "1,00 % + 5 Prozentpunkte = 6,00 % jährlich."
        },
        {
          "label": "Ohne Verbraucher",
          "detail": "Entgeltforderung: 1,00 % + 9 Punkte = 10,00 %."
        }
      ]
    },
    {
      "id": "verjaehrung",
      "type": "flow",
      "title": "Regelverjährung am einfachen Zahlungsanspruch",
      "description": "Anspruch und Kenntnis 2026; kein Sonderbeginn, keine Hemmung, kein Neubeginn.",
      "items": [
        {
          "label": "2026: Voraussetzungen",
          "detail": "Anspruch entstanden; Schuldner bekannt."
        },
        {